{
  "id": "tented-camping",
  "title": "Tanzania Classic camping safari",
  "summary": null,
  "body": "Our Tented Classic Safaris\n\nA classic tented safari offers a timeless escape into nature. Despite changes over the years, the sight of a simple canvas tent under a shady tree or beside a waterhole remains iconic in the safari experience.\nMazingira Camp partners ensure your comfort and a sense of home. Relax in your tent with the breeze through the canvas, or unwind in the communal area with a book and a refreshing drink. Sit back under the flysheet shade and watch the plains and wildlife.\nEvenings bring the cherished safari traditions of drinks and stories around the fire, evoking a sense of simpler times. Enjoy communal dining, celebrating the union of old and new friends. As night falls, the soft lamp light creates a serene ambiance, perfect for stargazing and observing the night's quiet activity.\n\nYour home away from home\nYour tent is fully equipped for relaxation and reflection: a comfortable bed with soft linens ensures restful sleep after exciting safari days. The innovative bucket shower, heated over the fire, offers a refreshing end to your day. Mornings begin with the melodies of songbirds as you savor freshly brewed coffee or tea outside your tent. In the afternoon, reflect on your day’s adventures at your writing desk, capturing the memories of your journey.\nMobile camps\nMazingira Camp partners' mobile camps are ingeniously designed to move with the seasons, ensuring guests can experience unique and secluded locations—whether nestled in woodland greenery, under the shadow of a kopje, or along a riverbank. Always closely following the annual wildebeest migration, these camps are set up and taken down leaving only joyful memories behind.\nThe camps' discreet structures harmonize with the environment, often attracting wildlife right through the campsite. Elephants might choose a spot among the tents for a nap, while leopards could stealthily pass by as you enjoy dinner by the campfire. Staying at these camps offers a profound connection to nature and a deeper appreciation of the wild.",
  "images": [
    {
      "src": "https://static.wixstatic.com/media/1ac0ef_6179c700dc0548c7a31bccc08e19cf79~mv2.png",
      "alt": "Mazingira Safaris Eco Friendly Safari Logo"
    },
    {
      "src": "https://static.wixstatic.com/media/1ac0ef_6354a58d05424bf3b5823ecb73e4d47b~mv2.jpg",
      "alt": "A camping site for camping safaris, this is a beautiful sunrise Serengeti scene as guest were about to leave for an early morning safari"
    },
    {
      "src": "https://static.wixstatic.com/media/1ac0ef_2e8a6bcf719c4c39b997b15693a8359f~mv2.png",
      "alt": "A tented accomodation for a tanzania safari, a beautiful located tented in the wilderness of Tanzania"
    },
    {
      "src": "https://static.wixstatic.com/media/1ac0ef_aea9d2521071435aaa49274427b17209~mv2.jpeg",
      "alt": "Tato Logo"
    }
  ],
  "source": "https://www.mazingirasafari.com/tented-safari"
}
