{
  "id": "walking-safari",
  "title": "Walking Safaris",
  "summary": null,
  "body": "Walking Safaris & Crater Rim Walks\nEnhance your Tanzanian adventure by including a walking safari in your itinerary. This unique experience allows you to immerse yourself in the vibrant ecosystems of Tanzania, exploring them on foot for a closer, more intimate encounter with nature. Led by experienced, armed rangers, your safety is ensured as you navigate through the diverse landscapes.\n\nExpert Guidance for a Safe Journey\nYour walking safari will be guided by professional rangers who are not only equipped to ensure your safety but are also deeply knowledgeable about the local wildlife and terrain. Their expertise allows you to delve into the intricacies of the African bush with confidence and curiosity.\nDiscover Arusha National Park and Beyond\nA walking safari in Arusha National Park is an excellent choice, especially as a concluding highlight of your journey. Its proximity to Kilimanjaro Airport makes it an accessible and rewarding destination. Each step through this park offers the chance to encounter a wide array of animals in their natural habitats— from graceful giraffes and buffaloes to a variety of bird species.\nCrater Rim Walk at Ngorongoro\nFor a truly spectacular perspective, opt for a crater rim walk around the Ngorongoro Crater. This walk offers an amazing insight into the wildlife and vegetation that inhabit the crater's rim. The elevated views over the crater floor, combined with the lush, diverse ecosystem at the rim, provide a unique opportunity to observe and appreciate the natural beauty and ecological variety of this famous conservation area.\nTailored Experiences Across Tanzania\nWhile Arusha National Park and the Ngorongoro Crater are prime locations for walking safaris, other parks throughout Tanzania also offer their unique landscapes and wildlife. Each park provides a different experience, from the sweeping plains of the Serengeti to the rugged terrains of Tarangire, enhancing your safari with new sights, sounds, and encounters.\nBy choosing to participate in a walking safari, you gain a deeper appreciation of the natural world, experiencing the wonders of Tanzania from a ground-level perspective that few tours can match. This immersive experience brings you face-to-face with the untamed beauty of Africa in a truly memorable and engaging way.\n\n## Would you like to add a walking Safari to your trip ?",
  "images": [
    {
      "src": "https://static.wixstatic.com/media/1ac0ef_6179c700dc0548c7a31bccc08e19cf79~mv2.png",
      "alt": "Mazingira Safaris Eco Friendly Safari Logo"
    },
    {
      "src": "https://static.wixstatic.com/media/nsplsh_6b2d382d65583459336e6f~mv2_d_3545_2161_s_2.jpg",
      "alt": "Image by Ron Dauphin"
    },
    {
      "src": "https://static.wixstatic.com/media/1ac0ef_1eb4e5bc57d14007890400665d7ae6ba~mv2.jpg",
      "alt": "Tourists with a safari guide on a crater rim walk round the ngorongoro crater, learning about the flora and fauna"
    },
    {
      "src": "https://static.wixstatic.com/media/1ac0ef_b4e09c361af44aef89f75d8fdc4f9e9f~mv2.jpg",
      "alt": "A tourist on a walking safari with Mazingira Safaris capturing the beauty of the African giraffe"
    },
    {
      "src": "https://static.wixstatic.com/media/1ac0ef_aea9d2521071435aaa49274427b17209~mv2.jpeg",
      "alt": "Tato Logo"
    }
  ],
  "source": "https://www.mazingirasafari.com/walking-safaris"
}
