{
  "id": "night-game-drive",
  "title": "Night Time Game Drives",
  "summary": null,
  "body": "Beneath the vast African night sky, the darkness unveils a hidden world of shy and elusive nocturnal creatures.\nA night safari drive is an exhilarating experience, offering a fresh and thrilling perspective on wildlife viewing. As daylight fades, your heightened senses tune into the mysterious sounds and movements of the night, guided by the sweep of your guide's powerful spotlight across the bush in search of reflective eyes.\nSpotting Africa's nocturnal animals, like lions, leopards, hyenas, wild dogs, and other less-seen nocturnal species, is a rare treat. These creatures come alive in the cooler night conditions, and seeing their eyes glow under the red-filtered spotlight offers a starkly different and eerie experience compared to daytime safaris.\nDuring the drive, you might spot owls, nightjars, chameleons, and bush babies in their natural habitats, sometimes catching the quiet drama of an owl capturing its prey. The absence of light pollution allows the stars of the East African sky to shine brightly, with your guide pointing out constellations and galaxies, adding an educational layer to your adventure.\nA safari night drive is not just an outing; it’s an immersive journey into the nocturnal heart of the wilderness, making it a must-experience activity for anyone visiting the region.\n\n## Have a unique adventure in mind? Let’s help you plan",
  "images": [
    {
      "src": "https://static.wixstatic.com/media/1ac0ef_6179c700dc0548c7a31bccc08e19cf79~mv2.png",
      "alt": "Mazingira Safaris Eco Friendly Safari Logo"
    },
    {
      "src": "https://static.wixstatic.com/media/1ac0ef_7e07c14239154dd2ae51aed7ae85de33~mv2.jpg",
      "alt": "Male Lion spotted on a night time game drive in Lake Manyara National Park, lit up by the truth headlights and spotted by the safari spotter. he is looking directly at the safari truck"
    },
    {
      "src": "https://static.wixstatic.com/media/1ac0ef_0c9bb3ac8a034e18bf934699bf37b1cf~mv2.png",
      "alt": "Leopard in the Spot Light"
    },
    {
      "src": "https://static.wixstatic.com/media/1ac0ef_d156bcfa3bc848689e49c0ac37732079~mv2.png",
      "alt": "Night Time Safari Truck"
    },
    {
      "src": "https://static.wixstatic.com/media/1ac0ef_16d55d0420b74c20a3df7294cfc67c63~mv2.png",
      "alt": "Serval"
    },
    {
      "src": "https://static.wixstatic.com/media/1ac0ef_aea9d2521071435aaa49274427b17209~mv2.jpeg",
      "alt": "Tato Logo"
    }
  ],
  "source": "https://www.mazingirasafari.com/night-time-game-drives"
}
