{
  "id": "maasai-village",
  "title": "Maasai Village Visits",
  "summary": null,
  "body": "Visit The Traditional Maasai Villages\n\nExplore the rich cultural heritage of Tanzania with an enriching visit to a traditional Maasai village, thoughtfully offered as an optional add-on by Mazingira Safaris. This unique excursion takes you off the beaten track to a Maasai community that preserves its age-old traditions and ways of life, far removed from more commercialized villages.\n\nAuthentic Cultural Experience\nUpon arrival, you'll be warmly welcomed by the Maasai, renowned for their vibrant clothing and intricate beadwork. You'll have the opportunity to don traditional Maasai garments, allowing for a deep dive into their culture. This hands-on approach helps you appreciate their customs and lifestyle authentically.\nInteractive Activities\nYour visit is not just observational—it's an interactive immersion. Participate in Maasai dances, a central part of their cultural celebrations and communal gatherings. Learn the traditional art of fire-making, a skill essential to the Maasai way of life and passed down through generations. These activities offer a practical understanding of the Maasai's daily routines and survival techniques.\nExplore Traditional Living\nDuring your tour, you'll explore the layout and structure of a Maasai village, including the enkang (homestead) and the manyatta (huts). See firsthand how the Maasai live, from their unique building techniques to their daily practices, providing a genuine glimpse into their enduring culture.\nCultural Preservation and Respect\nMazingira Safaris is committed to respectful and responsible tourism. This visit not only educates travelers about Maasai life but also supports the community, ensuring they benefit directly from our visits.\n\nWhy Add This Experience?\nAdding a visit to a Maasai village to your Tanzanian safari offers a profound contrast to the wildlife-focused aspects of your trip. It enriches your travel experience by connecting you with the human element of this diverse country, deepening your understanding of its people and their heritage.\nThis excursion is available for an additional fee, ensuring that it caters to those truly interested in engaging with and learning from the Maasai culture. It's an eye-opening addition that promises to enhance your safari with unforgettable memories and insights.\n\n## Subscribe to Our Newsletter\n\nThanks for submitting!",
  "images": [
    {
      "src": "https://static.wixstatic.com/media/1ac0ef_6179c700dc0548c7a31bccc08e19cf79~mv2.png",
      "alt": "Mazingira Safaris Eco Friendly Safari Logo"
    },
    {
      "src": "https://static.wixstatic.com/media/1ac0ef_4bf66b0e210b4d6db809dff7adeae5fd~mv2.jpg",
      "alt": "Maasai people in the Ngorongoro Region in Tanzania walking home to their masai village"
    },
    {
      "src": "https://static.wixstatic.com/media/1ac0ef_8208ee07f7ea49df861d465e2030454d~mv2.jpg",
      "alt": "A Maasai person guiding tourist to visit his Maasai Village, in traditional Maasai clothing"
    },
    {
      "src": "https://static.wixstatic.com/media/1ac0ef_62c07be3b319424fabf5384e79ee40e6~mv2.png",
      "alt": "Maasai group preforming their local tribal dance a jumping competition between the males of the group."
    },
    {
      "src": "https://static.wixstatic.com/media/1ac0ef_aea9d2521071435aaa49274427b17209~mv2.jpeg",
      "alt": "Tato Logo"
    }
  ],
  "source": "https://www.mazingirasafari.com/maasai-village"
}
