{
  "id": "sunset-picnic",
  "title": "Sunset Picnics",
  "summary": "A private sunset picnic in the bush with hot food, drinks and blankets, guarded by a Maasai guide, within 20 minutes of your lodge. Ideal for honeymoons and anniversaries.",
  "body": "Immerse yourself in the serene beauty of the Tanzanian wilderness with a romantic sunset picnic, meticulously curated by Mazingira Safaris to elevate your safari experience. As the sun sets over the majestic Serengeti, you and your loved one can enjoy a tranquil and intimate dining experience, surrounded by the breathtaking landscapes that make Tanzania a top safari destination.\nSafety and Comfort in the Wilderness\nYour safety and comfort are our utmost priorities. To ensure a secure environment, a knowledgeable Maasai guide will accompany you, offering both protection and fascinating insights into the local flora and fauna. The Maasai's presence enriches the experience, blending cultural heritage with the natural beauty of the bush.\nTailored to Your Preference\nWe understand that each guest has unique comfort levels and preferences. For those who prefer not to stray far from the safety of a vehicle, we can arrange for the picnic to be set up within or near the truck. For the more adventurous spirits, a comfortable and scenic setup in the bush will provide an unobstructed view of the sunset, creating a truly immersive experience. All locations are carefully selected within a 20-minute drive from your accommodation, ensuring you spend more time enjoying the moment and less time traveling.\nA Dining Experience Like No Other\nAs the sky paints itself with the glorious colors of the African sunset, you will be treated to a hot food picnic featuring a mix of local and international cuisine. To cater to all preferences, we provide a selection of both alcoholic and non-alcoholic beverages. Cozy blankets are also provided, perfect for snuggling under as the evening air cools, adding an extra layer of comfort and romance to the setting.\nWhy Add This to Your Trip?\nAdding a sunset picnic to your safari trip offers a unique opportunity to create lasting memories with your partner. It’s not just a meal; it’s a moment to connect, to enjoy each other's company in one of the most stunning settings on earth. This experience combines the thrill of adventure with the intimacy of a quiet, private meal, making it an ideal choice for those looking to celebrate love, anniversaries, honeymoons, or simply the joy of shared experience.\nA sunset picnic with Mazingira Safaris isn't just another meal; it's a celebration of love, nature, and tranquility, all wrapped into one exclusive and memorable package. Whether you're watching the wildlife in the distance or gazing into a starlit sky, this experience promises to be as enchanting as it is unforgettable.",
  "images": [
    {
      "src": "https://static.wixstatic.com/media/1ac0ef_6179c700dc0548c7a31bccc08e19cf79~mv2.png",
      "alt": "Mazingira Safaris Eco Friendly Safari Logo"
    },
    {
      "src": "https://static.wixstatic.com/media/1ac0ef_235632bed7ef4543a5c6668e0b090fb1~mv2.jpg",
      "alt": "Sunset Picnic 3 wine glasses saying cheers to there end of day safari"
    },
    {
      "src": "https://static.wixstatic.com/media/1ac0ef_e84d5cade86740bfb20782a8427163ab~mv2.jpg",
      "alt": "Sunsets in the Serengeti, a picnic arranged by Mazingira Safari . picnics can be set up in the bush close to camps"
    },
    {
      "src": "https://static.wixstatic.com/media/1ac0ef_aea9d2521071435aaa49274427b17209~mv2.jpeg",
      "alt": "Tato Logo"
    }
  ],
  "source": "https://www.mazingirasafari.com/sunset-picnics"
}
