{
  "id": "balloon-safari",
  "title": "Hot Air Balloon Safari",
  "summary": null,
  "body": "Experience the thrill of a hot-air balloon safari in Tanzania's Serengeti, one of the most iconic wildlife destinations on the planet. As the balloon inflates in the cool early morning air, anticipation builds. Soon, you're silently ascending over the expansive savannahs, rich with wildlife and stunning scenery. Designed for small groups, this unique adventure offers an unparalleled view of the Serengeti's vast landscapes and the annual Great Migration.\nFrom your vantage point above, you gain a profound appreciation of the sheer scale of the landscape and the incredible journey undertaken by countless wildebeest, zebra, and gazelle. The quiet glide of the balloon allows you to observe the natural behaviors of these animals without disturbance, providing extraordinary photo opportunities and a peaceful observation of their daily life and survival challenges.\nA hot-air balloon safari in the Serengeti is not just a ride; it's an extraordinary way to witness the world's most spectacular wildlife migration and adds an unforgettable perspective to your Tanzanian adventure. This experience, often highlighted as a must-do, enriches any wildlife-viewing itinerary with its breathtaking panoramas and serene, floating journey through the sky.\n\nOur Wonderful Partners Serengeti Balloon Safaris",
  "images": [
    {
      "src": "https://static.wixstatic.com/media/1ac0ef_6179c700dc0548c7a31bccc08e19cf79~mv2.png",
      "alt": "Mazingira Safaris Eco Friendly Safari Logo"
    },
    {
      "src": "https://static.wixstatic.com/media/1ac0ef_337b2dba9251466580afbf109a2b5b1a~mv2.jpg",
      "alt": "Safaritruck watching as its guests rise up on their hot air balloon safari, against the back drop of the purple and pink sunset skies"
    },
    {
      "src": "https://static.wixstatic.com/media/1ac0ef_aea9d2521071435aaa49274427b17209~mv2.jpeg",
      "alt": "Tato Logo"
    }
  ],
  "source": "https://www.mazingirasafari.com/balloon-safaris"
}
